{
  "profileImage": "/images/proxyfil.webp",
  "profileAlt": "Photo of Pierre-Louis Leclerc (Proxyfil) for the blog",
  "profileLink": "/about-me",
  "profileTitle": "DevOps Engineer Student",
  "profileName": "Pierre-Louis Leclerc",
  "github": "https://github.com/proxyfil",
  "githubText": "Want to see my code?",
  "portfolioImage": "/images/portfolio.webp",
  "email": "leclerc.pierre-louis@gmail.com",
  "linkedin": "https://www.linkedin.com/in/pierre-louis-leclerc/",
  "instagram": "https://www.instagram.com/pierrelouisirl/",
  "youtube": "https://www.youtube.com/@proxyfil4036",
  "alias": "Proxyfil",
  "contactSectionTitle": "Ready to take your idea to the next level?",
  "contactSectionSubtitle": "Let's work together.",
  "contactSectionButtonText": "Contact Me",
  "contactSectionButtonIcon": "paperplane",
  "techsTitle": "TECHS",
  "instagramIconName": "instagram",
  "youtubeIconName": "youtube",
  "githubIconName": "github",
  "linkedinIconName": "linkedin",
  "emailIconName": "envelope"
}